objectid,filename,image_thumb,title,date,field-date,theatre-name,playwright,subject,source,location,url,rights,rightsstatement
BP_TRHM_0047,https://archive.org/details/BP_TRHM_0047/mode/2up?view=theater,https://archive.org/services/img/BP_TRHM_0047,,1841-04-28,1841-04-28,Theatre Royal; Hay-Market,,,"English Playbill collection, Bruce Peel Special Collection, University of Alberta Library","Oversize01, Folder_60",https://archive.org/details/BP_TRHM_0047,Public domain,https://creativecommons.org/publicdomain/mark/1.0/
BP_TRHM_0048,https://archive.org/details/BP_TRHM_0048/mode/2up?view=theater,https://archive.org/services/img/BP_TRHM_0048,Education; Suzanne; St. Mary's Eve,1841-04-29,1841-04-29,Theatre Royal; Hay-Market,Morton; [unknown]; Mr. Bernard,comedy; petite drama; domestic drama,"English Playbill collection, Bruce Peel Special Collection, University of Alberta Library","Oversize01, Folder_60",https://archive.org/details/BP_TRHM_0048,Public domain,https://creativecommons.org/publicdomain/mark/1.0/
BP_TRHM_0049,https://archive.org/details/BP_TRHM_0049/mode/2up?view=theater,https://archive.org/services/img/BP_TRHM_0049,,1841-04-29,1841-04-29,Theatre Royal; Hay-Market,,,"English Playbill collection, Bruce Peel Special Collection, University of Alberta Library","Oversize01, Folder_60",https://archive.org/details/BP_TRHM_0049,Public domain,https://creativecommons.org/publicdomain/mark/1.0/
BP_TRHM_0050,https://archive.org/details/BP_TRHM_0050/mode/2up?view=theater,https://archive.org/services/img/BP_TRHM_0050,The Road to Ruin; Suzanne; St. Mary's Eve,1841-04-30,1841-04-30,Theatre Royal; Hay-Market,Holcroft; [unknown]; Mr. Bernard,comedy; petite drama; domestic drama,"English Playbill collection, Bruce Peel Special Collection, University of Alberta Library","Oversize01, Folder_60",https://archive.org/details/BP_TRHM_0050,Public domain,https://creativecommons.org/publicdomain/mark/1.0/
BP_TRHM_0051,https://archive.org/details/BP_TRHM_0051/mode/2up?view=theater,https://archive.org/services/img/BP_TRHM_0051,,1841-04-30,1841-04-30,Theatre Royal; Hay-Market,,,"English Playbill collection, Bruce Peel Special Collection, University of Alberta Library","Oversize01, Folder_60",https://archive.org/details/BP_TRHM_0051,Public domain,https://creativecommons.org/publicdomain/mark/1.0/
BP_TRHM_0052,https://archive.org/details/BP_TRHM_0052/mode/2up?view=theater,https://archive.org/services/img/BP_TRHM_0052,,1841-05-01,[1841-05-01],Theatre Royal; Hay-Market,,,"English Playbill collection, Bruce Peel Special Collection, University of Alberta Library","Oversize01, Folder_60",https://archive.org/details/BP_TRHM_0052,Public domain,https://creativecommons.org/publicdomain/mark/1.0/
BP_TRHM_0053,https://archive.org/details/BP_TRHM_0053/mode/2up?view=theater,https://archive.org/services/img/BP_TRHM_0053,Money,1841-05-03,1841-05-03,Theatre Royal; Hay-Market,"Sir Edward Lytton Bulwer, Bart.",comedy,"English Playbill collection, Bruce Peel Special Collection, University of Alberta Library","Oversize01, Folder_60",https://archive.org/details/BP_TRHM_0053,Public domain,https://creativecommons.org/publicdomain/mark/1.0/
BP_TRHM_0054,https://archive.org/details/BP_TRHM_0054/mode/2up?view=theater,https://archive.org/services/img/BP_TRHM_0054,St. Mary's Eve,1841-05-03,1841-05-03,Theatre Royal; Hay-Market,Mr. Bernard,domestic drama,"English Playbill collection, Bruce Peel Special Collection, University of Alberta Library","Oversize01, Folder_60",https://archive.org/details/BP_TRHM_0054,Public domain,https://creativecommons.org/publicdomain/mark/1.0/
BP_TRHM_0055,https://archive.org/details/BP_TRHM_0055/mode/2up?view=theater,https://archive.org/services/img/BP_TRHM_0055,The Lady of Lyons; Suzanne; Family Jars,1841-05-04,1841-05-04,Theatre Royal; Hay-Market,Sir Edward Lytton Bulwer; [unknown]; [unknown],[unknown]; petite drama; farce,"English Playbill collection, Bruce Peel Special Collection, University of Alberta Library","Oversize01, Folder_60",https://archive.org/details/BP_TRHM_0055,Public domain,https://creativecommons.org/publicdomain/mark/1.0/
BP_TRHM_0056,https://archive.org/details/BP_TRHM_0056/mode/2up?view=theater,https://archive.org/services/img/BP_TRHM_0056,,1841-05-05,[1841-05-05],Theatre Royal; Hay-Market,,,"English Playbill collection, Bruce Peel Special Collection, University of Alberta Library","Oversize01, Folder_60",https://archive.org/details/BP_TRHM_0056,Public domain,https://creativecommons.org/publicdomain/mark/1.0/
BP_TRHM_0057,https://archive.org/details/BP_TRHM_0057/mode/2up?view=theater,https://archive.org/services/img/BP_TRHM_0057,Money; Suzanne; A Nabob for an Hour,1841-05-06,1841-05-06,Theatre Royal; Hay-Market,Sir Edward Lytton Bulwer; [unknown]; Poole,comedy; petite drama; comedy,"English Playbill collection, Bruce Peel Special Collection, University of Alberta Library","Oversize01, Folder_60",https://archive.org/details/BP_TRHM_0057,Public domain,https://creativecommons.org/publicdomain/mark/1.0/
BP_TRHM_0058,https://archive.org/details/BP_TRHM_0058/mode/2up?view=theater,https://archive.org/services/img/BP_TRHM_0058,The Honey Moon; St. Mary's Eve; Money,1841-05-07,1841-05-07,Theatre Royal; Hay-Market,Tobin; Mr. Bernard; Sir Edward Lytton Bulwer,comedy; domestic drama; comedy,"English Playbill collection, Bruce Peel Special Collection, University of Alberta Library","Oversize01, Folder_60",https://archive.org/details/BP_TRHM_0058,Public domain,https://creativecommons.org/publicdomain/mark/1.0/
BP_TRHM_0059,https://archive.org/details/BP_TRHM_0059/mode/2up?view=theater,https://archive.org/services/img/BP_TRHM_0059,The Lady of Lyons; Suzanne; A Nabob for an Hour,1841-05-08,1841-05-08,Theatre Royal; Hay-Market,Sir Edward Lytton Bulwer; [unknown]; Poole,[unknown]; petite drama; comedy,"English Playbill collection, Bruce Peel Special Collection, University of Alberta Library","Oversize01, Folder_60",https://archive.org/details/BP_TRHM_0059,Public domain,https://creativecommons.org/publicdomain/mark/1.0/
BP_TRHM_0060,https://archive.org/details/BP_TRHM_0060/mode/2up?view=theater,https://archive.org/services/img/BP_TRHM_0060,Money; Suzanne; Katherine and Petruchio,1841-05-10,1841-05-10,Theatre Royal; Hay-Market,Sir Edward Lytton Bulwer; [unknown]; Wm. Shakespeare,comedy; petite drama; comedy,"English Playbill collection, Bruce Peel Special Collection, University of Alberta Library","Oversize01, Folder_60",https://archive.org/details/BP_TRHM_0060,Public domain,https://creativecommons.org/publicdomain/mark/1.0/
BP_TRHM_0061,https://archive.org/details/BP_TRHM_0061/mode/2up?view=theater,https://archive.org/services/img/BP_TRHM_0061,The Lady of Lyons; Suzanne; The Ladies' Club,1841-05-11,1841-05-11,Theatre Royal; Hay-Market,Edward Lytton Bulwer; [unknown]; [unknown],[unknown]; petite drama; [unknown],"English Playbill collection, Bruce Peel Special Collection, University of Alberta Library","Oversize01, Folder_60",https://archive.org/details/BP_TRHM_0061,Public domain,https://creativecommons.org/publicdomain/mark/1.0/
BP_TRHM_0062,https://archive.org/details/BP_TRHM_0062/mode/2up?view=theater,https://archive.org/services/img/BP_TRHM_0062,The Hunchback; St. Mary's Eve; John Jones,1841-05-12,1841-05-12,Theatre Royal; Hay-Market,Sheridan Knowles; Bayle Bernard; [unknown],[unknown]; domestic drama; farce,"English Playbill collection, Bruce Peel Special Collection, University of Alberta Library","Oversize01, Folder_60",https://archive.org/details/BP_TRHM_0062,Public domain,https://creativecommons.org/publicdomain/mark/1.0/
BP_TRHM_0063,https://archive.org/details/BP_TRHM_0063/mode/2up?view=theater,https://archive.org/services/img/BP_TRHM_0063,My Wife's Dentist; The Rent Day; Suzanne; Tom Noddy's Secret,1841-05-13,1841-05-13,Theatre Royal; Hay-Market,T. E. Wilks; Mr. Jerrold; [unknown]; Haynes Bayly,farce; domestic drama; petite drama; farce,"English Playbill collection, Bruce Peel Special Collection, University of Alberta Library","Oversize01, Folder_60",https://archive.org/details/BP_TRHM_0063,Public domain,https://creativecommons.org/publicdomain/mark/1.0/
BP_TRHM_0064,https://archive.org/details/BP_TRHM_0064/mode/2up?view=theater,https://archive.org/services/img/BP_TRHM_0064,"Werner: or, the Inheritance; St. Mary's Eve; John Jones",1841-05-14,1841-05-14,Theatre Royal; Hay-Market,Lord Byron; Bayle Bernard; [unknown],tragedy; domestic drama; farce,"English Playbill collection, Bruce Peel Special Collection, University of Alberta Library","Oversize01, Folder_60",https://archive.org/details/BP_TRHM_0064,Public domain,https://creativecommons.org/publicdomain/mark/1.0/
BP_TRHM_0065,https://archive.org/details/BP_TRHM_0065/mode/2up?view=theater,https://archive.org/services/img/BP_TRHM_0065,Money; The Child of the Wreck; My Wife's Dentist,1841-05-15,1841-05-15,Theatre Royal; Hay-Market,Edward Lytton Bulwer; [unknown]; T. E. Wilks,comedy; drama; farce,"English Playbill collection, Bruce Peel Special Collection, University of Alberta Library","Oversize01, Folder_60",https://archive.org/details/BP_TRHM_0065,Public domain,https://creativecommons.org/publicdomain/mark/1.0/
BP_TRHM_0100,https://archive.org/details/BP_TRHM_0100/mode/2up?view=theater,https://archive.org/services/img/BP_TRHM_0100,Macbeth; The Child of the Wreck; Bob Short,1841-05-17,1841-05-17,Theatre Royal; Hay-Market,Wm. Shakespeare; [unknown]; Mark Lemon,tragedy; drama; farce,"English Playbill collection, Bruce Peel Special Collection, University of Alberta Library","Oversize01, Folder_69",https://archive.org/details/BP_TRHM_0100,Public domain,https://creativecommons.org/publicdomain/mark/1.0/
BP_TRHM_0101,https://archive.org/details/BP_TRHM_0101/mode/2up?view=theater,https://archive.org/services/img/BP_TRHM_0101,Tom Noddy's Secret; The Philosophers of Berlin; The Child of the Wreck; A Nabob for an Hour,1841-05-18,1841-05-18,Theatre Royal; Hay-Market,Haynes Bayly; [unknown]; [unknown]; Poole,farce; comedy; drama; comedy,"English Playbill collection, Bruce Peel Special Collection, University of Alberta Library","Oversize01, Folder_69",https://archive.org/details/BP_TRHM_0101,Public domain,https://creativecommons.org/publicdomain/mark/1.0/
BP_TRHM_0102,https://archive.org/details/BP_TRHM_0102/mode/2up?view=theater,https://archive.org/services/img/BP_TRHM_0102,Macbeth; The Child of the Wreck; Bob Short,1841-05-19,1841-05-19,Theatre Royal; Hay-Market,Wm. Shakespeare; [unknown]; Mark Lemon,tragedy; drama; farce,"English Playbill collection, Bruce Peel Special Collection, University of Alberta Library","Oversize01, Folder_69",https://archive.org/details/BP_TRHM_0102,Public domain,https://creativecommons.org/publicdomain/mark/1.0/
BP_TRHM_0103,https://archive.org/details/BP_TRHM_0103/mode/2up?view=theater,https://archive.org/services/img/BP_TRHM_0103,Suzanne; The Philosophers of Berlin; The Child of the Wreck; A Nabob for an Hour,1841-05-20,1841-05-20,Theatre Royal; Hay-Market,[unknown]; [unknown]; [unknown]; Poole,petite drama; comedy; drama; comedy,"English Playbill collection, Bruce Peel Special Collection, University of Alberta Library","Oversize01, Folder_69",https://archive.org/details/BP_TRHM_0103,Public domain,https://creativecommons.org/publicdomain/mark/1.0/
BP_TRHM_0104,https://archive.org/details/BP_TRHM_0104/mode/2up?view=theater,https://archive.org/services/img/BP_TRHM_0104,Suzanne; The Philosophers of Berlin; The Child of the Wreck; A Nabob for an Hour,1841-05-22,1841-05-22,Theatre Royal; Hay-Market,[unknown]; [unknown]; [unknown]; Poole,petite drama; comedy; drama; comedy,"English Playbill collection, Bruce Peel Special Collection, University of Alberta Library","Oversize01, Folder_69",https://archive.org/details/BP_TRHM_0104,Public domain,https://creativecommons.org/publicdomain/mark/1.0/
BP_TRHM_0105,https://archive.org/details/BP_TRHM_0105/mode/2up?view=theater,https://archive.org/services/img/BP_TRHM_0105,Sweethearts and Wives; The Philosophers of Berline; St. Mary's Eve,1841-05-25,1841-05-25,Theatre Royal; Hay-Market,[unknown]; [unknown]; [unknown],operatic comedy; comedy; domestic drama,"English Playbill collection, Bruce Peel Special Collection, University of Alberta Library","Oversize01, Folder_69",https://archive.org/details/BP_TRHM_0105,Public domain,https://creativecommons.org/publicdomain/mark/1.0/
BP_TRHM_0106,https://archive.org/details/BP_TRHM_0106/mode/2up?view=theater,https://archive.org/services/img/BP_TRHM_0106,My Little Adopted; The Philosophers of Berlin; The Child of the Wreck; Sweethearts and Wives,1841-05-27,1841-05-27,Theatre Royal; Hay-Market,[unknown]; [unknown]; [unknown]; [unknown],petite comedy; comedy; drama; operatic comedy,"English Playbill collection, Bruce Peel Special Collection, University of Alberta Library","Oversize01, Folder_69",https://archive.org/details/BP_TRHM_0106,Public domain,https://creativecommons.org/publicdomain/mark/1.0/
BP_TRHM_0107,https://archive.org/details/BP_TRHM_0107/mode/2up?view=theater,https://archive.org/services/img/BP_TRHM_0107,The Stranger; Suzanne; A Nabob for an Hour,1841-05-28,1841-05-28,Theatre Royal; Hay-Market,[unknown]; [unknown]; Poole,[unknown]; petite drama; comedy,"English Playbill collection, Bruce Peel Special Collection, University of Alberta Library","Oversize01, Folder_69",https://archive.org/details/BP_TRHM_0107,Public domain,https://creativecommons.org/publicdomain/mark/1.0/
BP_TRHM_0108,https://archive.org/details/BP_TRHM_0108/mode/2up?view=theater,https://archive.org/services/img/BP_TRHM_0108,My Little Adopted; Marie Ducange; The Philosophers of Berlin,1841-05-29,1841-05-29,Theatre Royal; Hay-Market,[unknown]; Bayle Bernard; [unknown],comedy; drama; comedy,"English Playbill collection, Bruce Peel Special Collection, University of Alberta Library","Oversize01, Folder_69",https://archive.org/details/BP_TRHM_0108,Public domain,https://creativecommons.org/publicdomain/mark/1.0/
BP_TRHM_0110,https://archive.org/details/BP_TRHM_0110/mode/2up?view=theater,https://archive.org/services/img/BP_TRHM_0110,The Stranger; Marie Ducange; Bob Short,1841-05-31,1841-05-31,Theatre Royal; Hay-Market,[unknown]; Bayle Bernard; Mark Lemon,[unknown]; drama; farce,"English Playbill collection, Bruce Peel Special Collection, University of Alberta Library","Oversize01, Folder_69",https://archive.org/details/BP_TRHM_0110,Public domain,https://creativecommons.org/publicdomain/mark/1.0/
BP_TRHM_0012,https://archive.org/details/BP_TRHM_0012/mode/2up?view=theater,https://archive.org/services/img/BP_TRHM_0012,The Man of the World; Marie Ducange; A Nabob for an Hour,1841-06-01,1841-06-01,Theatre Royal; Hay-Market,[unknown]; Bayle Bernard; Poole,comedy; drama; comedy,"English Playbill collection, Bruce Peel Special Collection, University of Alberta Library","Oversize01, Folder_59",https://archive.org/details/BP_TRHM_0012,Public domain,https://creativecommons.org/publicdomain/mark/1.0/
BP_TRHM_0014,https://archive.org/details/BP_TRHM_0014/mode/2up?view=theater,https://archive.org/services/img/BP_TRHM_0014,Macbeth; Marie Ducange,1841-06-02,1841-06-02,Theatre Royal; Hay-Market,Wm. Shakespeare; Bayle Bernard,tragedy; drama,"English Playbill collection, Bruce Peel Special Collection, University of Alberta Library","Oversize01, Folder_59",https://archive.org/details/BP_TRHM_0014,Public domain,https://creativecommons.org/publicdomain/mark/1.0/
BP_TRHM_0015,https://archive.org/details/BP_TRHM_0015/mode/2up?view=theater,https://archive.org/services/img/BP_TRHM_0015,The Man of the World; Marie Ducange; A Nabob for an Hour,1841-06-03,1841-06-03,Theatre Royal; Hay-Market,[unknown]; Bayle Bernard; Poole,comedy; drama; comedy,"English Playbill collection, Bruce Peel Special Collection, University of Alberta Library","Oversize01, Folder_59",https://archive.org/details/BP_TRHM_0015,Public domain,https://creativecommons.org/publicdomain/mark/1.0/
BP_TRHM_0111,https://archive.org/details/BP_TRHM_0111/mode/2up?view=theater,https://archive.org/services/img/BP_TRHM_0111,,1841-06-04,1841-06-04 - 1841-08-04,Theatre Royal; Hay-Market,,,"English Playbill collection, Bruce Peel Special Collection, University of Alberta Library","Oversize01, Folder_70",https://archive.org/details/BP_TRHM_0111,Public domain,https://creativecommons.org/publicdomain/mark/1.0/
BP_TRHM_0114,https://archive.org/details/BP_TRHM_0114/mode/2up?view=theater,https://archive.org/services/img/BP_TRHM_0114,Money; Marie Ducange,1841-08-07,1841-08-07,Theatre Royal; Hay-Market,Sir Edward Lytton Bulwer; Bayle Bernard,comedy; drama,"English Playbill collection, Bruce Peel Special Collection, University of Alberta Library","Oversize01, Folder_71",https://archive.org/details/BP_TRHM_0114,Public domain,https://creativecommons.org/publicdomain/mark/1.0/
BP_TRHM_0115,https://archive.org/details/BP_TRHM_0115/mode/2up?view=theater,https://archive.org/services/img/BP_TRHM_0115,Virginius; The Child of the Wreck; Bob Short,1841-08-09,1841-08-09,Theatre Royal; Hay-Market,Sheridan Knowles; [unknown]; Mark Lemon,tragedy; drama; farce,"English Playbill collection, Bruce Peel Special Collection, University of Alberta Library","Oversize01, Folder_71",https://archive.org/details/BP_TRHM_0115,Public domain,https://creativecommons.org/publicdomain/mark/1.0/
BP_TRHM_0116,https://archive.org/details/BP_TRHM_0116/mode/2up?view=theater,https://archive.org/services/img/BP_TRHM_0116,The Lady of Lyons; Suzanne; My Friend the Captain,1841-08-10,1841-08-10,Theatre Royal; Hay-Market,Edward Lytton Bulwer; [unknown]; [unknown],[unknown]; petite drama; farce,"English Playbill collection, Bruce Peel Special Collection, University of Alberta Library","Oversize01, Folder_71",https://archive.org/details/BP_TRHM_0116,Public domain,https://creativecommons.org/publicdomain/mark/1.0/
BP_TRHM_0118,https://archive.org/details/BP_TRHM_0118/mode/2up?view=theater,https://archive.org/services/img/BP_TRHM_0118,"Foreign Affairs: or, the Court of Queen Anne; My Friend the Captain; The French Spy",1841-08-11,1841-08-11,Theatre Royal; Hay-Market,[unknown]; [unknown]; [unknown],comedy; farce; [unknown],"English Playbill collection, Bruce Peel Special Collection, University of Alberta Library","Oversize01, Folder_71",https://archive.org/details/BP_TRHM_0118,Public domain,https://creativecommons.org/publicdomain/mark/1.0/
BP_TRHM_0120,https://archive.org/details/BP_TRHM_0120/mode/2up?view=theater,https://archive.org/services/img/BP_TRHM_0120,"Virginius; Foreign Affairs: or, the Court of Queen Anne; My Friend the Captain",1841-08-12,1841-08-12,Theatre Royal; Hay-Market,Sheridan Knowles; [unknown]; [unknown],tragedy; comedy; farce,"English Playbill collection, Bruce Peel Special Collection, University of Alberta Library","Oversize01, Folder_71",https://archive.org/details/BP_TRHM_0120,Public domain,https://creativecommons.org/publicdomain/mark/1.0/
BP_TRHM_0122,https://archive.org/details/BP_TRHM_0122/mode/2up?view=theater,https://archive.org/services/img/BP_TRHM_0122,"Money; Foreign Affairs: or, the Court of Queen Anne",1841-08-14,1841-08-14,Theatre Royal; Hay-Market,Edward Lytton Bulwer; [unknown],comedy; comedy,"English Playbill collection, Bruce Peel Special Collection, University of Alberta Library","Oversize01, Folder_71",https://archive.org/details/BP_TRHM_0122,Public domain,https://creativecommons.org/publicdomain/mark/1.0/
BP_TRHM_0124,https://archive.org/details/BP_TRHM_0124/mode/2up?view=theater,https://archive.org/services/img/BP_TRHM_0124,"William Tell; Foreign Affairs: or, the Court of Queen Anne; Bob Short",1841-08-16,1841-08-16,Theatre Royal; Hay-Market,Sheridan Knowles; [unknown]; Mark Lemon,[unknown]; comedy; farce,"English Playbill collection, Bruce Peel Special Collection, University of Alberta Library","Oversize01, Folder_71",https://archive.org/details/BP_TRHM_0124,Public domain,https://creativecommons.org/publicdomain/mark/1.0/
BP_TRHM_0125,https://archive.org/details/BP_TRHM_0125/mode/2up?view=theater,https://archive.org/services/img/BP_TRHM_0125,"Love a la Mode; Foreign Affairs: or, the Court of Queen Anne; Belford Castle: Or, the Scottish Gold-Mine; My Friend the Captain",1841-08-17,1841-08-17,Theatre Royal; Hay-Market,Macklin; [unknown]; [unknown]; [unknown],comedy; comedy; comedy; farce,"English Playbill collection, Bruce Peel Special Collection, University of Alberta Library","Oversize01, Folder_71",https://archive.org/details/BP_TRHM_0125,Public domain,https://creativecommons.org/publicdomain/mark/1.0/
BP_TRHM_0126,https://archive.org/details/BP_TRHM_0126/mode/2up?view=theater,https://archive.org/services/img/BP_TRHM_0126,"Lady of Lyons; Foreign Affairs: or, the Court of Queen Anne; Bob Short",1841-08-18,1841-08-18,Theatre Royal; Hay-Market,Sir Edward Lytton Bulwer; [unknown]; Mark Lemon,[unknown]; comedy; farce,"English Playbill collection, Bruce Peel Special Collection, University of Alberta Library","Oversize01, Folder_71",https://archive.org/details/BP_TRHM_0126,Public domain,https://creativecommons.org/publicdomain/mark/1.0/
BP_TRHM_0127,https://archive.org/details/BP_TRHM_0127/mode/2up?view=theater,https://archive.org/services/img/BP_TRHM_0127,"Virginius; Foreign Affairs: or, the Court of Queen Anne; My Friend the Captain",1841-08-19,1841-08-19,Theatre Royal; Hay-Market,Sheridan Knowles; [unknown]; [unknown],tragedy; comedy; farce,"English Playbill collection, Bruce Peel Special Collection, University of Alberta Library","Oversize01, Folder_71",https://archive.org/details/BP_TRHM_0127,Public domain,https://creativecommons.org/publicdomain/mark/1.0/
BP_TRHM_0128,https://archive.org/details/BP_TRHM_0128/mode/2up?view=theater,https://archive.org/services/img/BP_TRHM_0128,"The School for Scandal; Foreign Affairs: or, the Court of Queen Anne; John Jones",1841-08-20,1841-08-20,Theatre Royal; Hay-Market,Sheridan Knowles; [unknown]; [unknown],comedy; comedy; farce,"English Playbill collection, Bruce Peel Special Collection, University of Alberta Library","Oversize01, Folder_71",https://archive.org/details/BP_TRHM_0128,Public domain,https://creativecommons.org/publicdomain/mark/1.0/
BP_TRHM_0129,https://archive.org/details/BP_TRHM_0129/mode/2up?view=theater,https://archive.org/services/img/BP_TRHM_0129,"Money; Foreign Affairs: or, the Court of Queen Anne",1841-08-21,1841-08-21,Theatre Royal; Hay-Market,Sir Edward Lytton Bulwer; [unknown],comedy; comedy,"English Playbill collection, Bruce Peel Special Collection, University of Alberta Library","Oversize01, Folder_71",https://archive.org/details/BP_TRHM_0129,Public domain,https://creativecommons.org/publicdomain/mark/1.0/
BP_TRHM_0130,https://archive.org/details/BP_TRHM_0130/mode/2up?view=theater,https://archive.org/services/img/BP_TRHM_0130,"To Marry or Not to Marry; Foreign Affairs: or, the Court of Queen Anne; The French Spy",1841-08-25,1841-08-25,Theatre Royal; Hay-Market,Inchbald; [unknown]; [unknown],comedy; comedy; [unknown],"English Playbill collection, Bruce Peel Special Collection, University of Alberta Library","Oversize01, Folder_71",https://archive.org/details/BP_TRHM_0130,Public domain,https://creativecommons.org/publicdomain/mark/1.0/
BP_TRHM_0132,https://archive.org/details/BP_TRHM_0132/mode/2up?view=theater,https://archive.org/services/img/BP_TRHM_0132,"The Hunchback; Foreign Affairs: or, the Court of Queen Anne; John Jones",1841-08-27,1841-08-27,Theatre Royal; Hay-Market,Sheridan Knowles; [unknown]; [unknown],[unknown]; comedy; farce,"English Playbill collection, Bruce Peel Special Collection, University of Alberta Library","Oversize01, Folder_71",https://archive.org/details/BP_TRHM_0132,Public domain,https://creativecommons.org/publicdomain/mark/1.0/
BP_TRHM_0133,https://archive.org/details/BP_TRHM_0133/mode/2up?view=theater,https://archive.org/services/img/BP_TRHM_0133,"Money; Foreign Affairs: or, the Court of Queen Anne",1841-08-28,1841-08-28,Theatre Royal; Hay-Market,Sir Edward Lytton Bulwer; [unknown],comedy; comedy,"English Playbill collection, Bruce Peel Special Collection, University of Alberta Library","Oversize01, Folder_71",https://archive.org/details/BP_TRHM_0133,Public domain,https://creativecommons.org/publicdomain/mark/1.0/
BP_TRHM_0134,https://archive.org/details/BP_TRHM_0134/mode/2up?view=theater,https://archive.org/services/img/BP_TRHM_0134,"William Tell; Foreign Affairs: or, the Court of Queen Anne; My Friend the Captain",1841-08-30,1841-08-30,Theatre Royal; Hay-Market,Sheridan Knowles; [unknown]; [unknown],[unknown]; comedy; farce,"English Playbill collection, Bruce Peel Special Collection, University of Alberta Library","Oversize01, Folder_71",https://archive.org/details/BP_TRHM_0134,Public domain,https://creativecommons.org/publicdomain/mark/1.0/
BP_TRHM_0135,https://archive.org/details/BP_TRHM_0135/mode/2up?view=theater,https://archive.org/services/img/BP_TRHM_0135,To Marry or Not to Marry; The Boarding School; Sweethearts and Wives,1841-09-02,1841-09-02,Theatre Royal; Hay-Market,Inchbald; Bayle Bernard; [unknown],comedy; farce; operatic comedy,"English Playbill collection, Bruce Peel Special Collection, University of Alberta Library","Oversize01, Folder_71",https://archive.org/details/BP_TRHM_0135,Public domain,https://creativecommons.org/publicdomain/mark/1.0/
BP_TRHM_0136,https://archive.org/details/BP_TRHM_0136/mode/2up?view=theater,https://archive.org/services/img/BP_TRHM_0136,Town and Country; The Boarding School; Bob Short,1841-09-03,1841-09-03,Theatre Royal; Hay-Market,Morton; Bayle Bernard; Mark Lemon,comedy; farce; farce,"English Playbill collection, Bruce Peel Special Collection, University of Alberta Library","Oversize01, Folder_71",https://archive.org/details/BP_TRHM_0136,Public domain,https://creativecommons.org/publicdomain/mark/1.0/
