objectid,filename,image_thumb,title,date,field-date,theatre-name,playwright,subject,source,location,url,rights,rightsstatement
BP_VT_0002,https://archive.org/details/BP_VT_0002/mode/2up?view=theater,https://archive.org/services/img/BP_VT_0002,"A Happu Cruise; The Road to Ruin; The Orange Tree, Or, The Humble Bee; Or the Pretty Princess who was Lost at Sea",1873-12-10,[1873-12-10],Vaudeville Theatre,Ernest Cuthbert; Holcroft; H. J. Byron,comedietta; comedy; extravaganza,"English Playbill collection, Bruce Peel Special Collection, University of Alberta Library","Box02, Folder_23",https://archive.org/details/BP_VT_0002,Public domain,https://creativecommons.org/publicdomain/mark/1.0/
BP_GT_0006,https://archive.org/details/BP_GT_0006/mode/2up?view=theater,https://archive.org/services/img/BP_GT_0006,Clever Sir Jacob; The Hypocrite; Seeing Toole,1873-12-18,1873-12-18,Gaiety Theatre,Messrs. A. Percival Graves & P. Toft; Isaac Bickerstaff; R. Reece and John Hollingshead,comedietta; comedy; farce,"English Playbill collection, Bruce Peel Special Collection, University of Alberta Library","Box02, Folder_20",https://archive.org/details/BP_GT_0006,Public domain,https://creativecommons.org/publicdomain/mark/1.0/
BP_RLT_0074,https://archive.org/details/BP_RLT_0074/mode/2up?view=theater,https://archive.org/services/img/BP_RLT_0074,"Richelieu, Or, The Conspiracy; Simpson & Co.; Six Months Ago",1873-12-20,1873-12-20,Royal Lyceum Theatre,Lord Lytton; [unknown]; [unknown],[unknown]; [unknown]; [unknown],"English Playbill collection, Bruce Peel Special Collection, University of Alberta Library","Box03, Folder_44",https://archive.org/details/BP_RLT_0074,Public domain,https://creativecommons.org/publicdomain/mark/1.0/
BP_CC_0002,https://archive.org/details/BP_CC_0002/mode/2up?view=theater,https://archive.org/services/img/BP_CC_0002,The New Magdalen; Mr. Joffin's Latchkey,1874,1874 ?,Charing Cross Theatre,Wilkie Collins; Nugent Robinson,drama; farce,"English Playbill collection, Bruce Peel Special Collection, University of Alberta Library","Box02, Folder_24",https://archive.org/details/BP_CC_0002,Public domain,https://creativecommons.org/publicdomain/mark/1.0/
BP_RT_0001,https://archive.org/details/BP_RT_0001/mode/2up?view=theater,https://archive.org/services/img/BP_RT_0001,A Convenient Son-In-Law; Wild Oats; The Realm of Joy,1874-01-03,1874-01-03,Royalty Theatre,[unknown]; J. O'Keefe; F. Latour Tomline,farce; comedy; farce,"English Playbill collection, Bruce Peel Special Collection, University of Alberta Library","Box02, Folder_12",https://archive.org/details/BP_RT_0001,Public domain,https://creativecommons.org/publicdomain/mark/1.0/
BP_RLT_0079,https://archive.org/details/BP_RLT_0079/mode/2up?view=theater,https://archive.org/services/img/BP_RLT_0079,Philip; Simpson & Co.; A Husband in Clover,1874-02-26,1874-02-26,Royal Lyceum Theatre,Hamilton Aide; [unknown]; [unknown],romantic drama; [unknown]; comedietta,"English Playbill collection, Bruce Peel Special Collection, University of Alberta Library","Box03, Folder_44",https://archive.org/details/BP_RLT_0079,Public domain,https://creativecommons.org/publicdomain/mark/1.0/
BP_GT_0007,https://archive.org/details/BP_GT_0007/mode/2up?view=theater,https://archive.org/services/img/BP_GT_0007,The Magic Fife; Much Too Clever; Guy Fawkes,1874-03-04,1874-03-04,Gaiety Theatre,Offenbach; John Oxenford and Joseph Hatton; Henry J. Byron,operetta; comedy; musical satire,"English Playbill collection, Bruce Peel Special Collection, University of Alberta Library","Box02, Folder_20",https://archive.org/details/BP_GT_0007,Public domain,https://creativecommons.org/publicdomain/mark/1.0/
BP_RST_0006,https://archive.org/details/BP_RST_0006/mode/2up?view=theater,https://archive.org/services/img/BP_RST_0006,"Lending A Hand; May, Or, Dolly's Delusion; El Dorado",1874-04-04,1874-04-04,Royal Strand Theatre,Gilbert A'Beckett; R. Reece; H. B. Farnie,farce; [unknown]; musical,"English Playbill collection, Bruce Peel Special Collection, University of Alberta Library","Box03, Folder_36",https://archive.org/details/BP_RST_0006,Public domain,https://creativecommons.org/publicdomain/mark/1.0/
BP_CT_0003,https://archive.org/details/BP_CT_0003/mode/2up?view=theater,https://archive.org/services/img/BP_CT_0003,An American Lady; Nomandy Pippins,1874-04-18,1874-04-18,Criterion Theatre,Henry J. Byron; T. Grieve,comedy; musical,"English Playbill collection, Bruce Peel Special Collection, University of Alberta Library","Box02, Folder_22",https://archive.org/details/BP_CT_0003,Public domain,https://creativecommons.org/publicdomain/mark/1.0/
BP_AT_0011,https://archive.org/details/BP_AT_0011/mode/2up?view=theater,https://archive.org/services/img/BP_AT_0011,El Dorado; Uncle's Will; Good For Nothing; Mr. and Mrs. White; The Prayer in the Storm; Mr. and Mrs. White,1874-05-21,1874-05-21,Adelphi Theatre,B. Farnie; Theyne Smith; Buckstone; [unknown]; [unknown][unknown],musical; comedietta; comic drama; farce; drama; farce,"English Playbill collection, Bruce Peel Special Collection, University of Alberta Library","Box04, Folder_45",https://archive.org/details/BP_AT_0011,Public domain,https://creativecommons.org/publicdomain/mark/1.0/
BP_ROT_0007,https://archive.org/details/BP_ROT_0007/mode/2up?view=theater,https://archive.org/services/img/BP_ROT_0007,He Lies Like Truth; Much Ado About Nothing; Richelieu Redressed,1874-07-25,[1874-07-25],Royal Olympic Theatre,[unknown]; Wm. Shakespeare; R. Reece,[unknown]; comedy; political parody,"English Playbill collection, Bruce Peel Special Collection, University of Alberta Library","Box03, Folder_35",https://archive.org/details/BP_ROT_0007,Public domain,https://creativecommons.org/publicdomain/mark/1.0/
BP_RGT_0004,https://archive.org/details/BP_RGT_0004/mode/2up?view=theater,https://archive.org/services/img/BP_RGT_0004,Guy Fawkes; The Blind Sister; Jack Long of Texas,1874-11-05,1874-11-05,[New] [Royal] Grecian Theatre,[unknown]; Geo. Conquest and Paul Meritt; [unknown],[unknown]; melodrama; drama,"English Playbill collection, Bruce Peel Special Collection, University of Alberta Library","Oversize01, Folder_68",https://archive.org/details/BP_RGT_0004,Public domain,https://creativecommons.org/publicdomain/mark/1.0/
BP_RLT_0075,https://archive.org/details/BP_RLT_0075/mode/2up?view=theater,https://archive.org/services/img/BP_RLT_0075,Hamlet; Fish Out Of Water,1874-11-06,[1874-11-06],Royal Lyceum Theatre,Wm. Shakespeare; [unknown],tragedy; farce,"English Playbill collection, Bruce Peel Special Collection, University of Alberta Library","Box03, Folder_44",https://archive.org/details/BP_RLT_0075,Public domain,https://creativecommons.org/publicdomain/mark/1.0/
BP_CT_0002,https://archive.org/details/BP_CT_0002/mode/2up?view=theater,https://archive.org/services/img/BP_CT_0002,Les Pres Saint Gervais,1874-11-28,1874-11-28,Criterion Theatre,Charles Lecocq,opera,"English Playbill collection, Bruce Peel Special Collection, University of Alberta Library","Box02, Folder_22",https://archive.org/details/BP_CT_0002,Public domain,https://creativecommons.org/publicdomain/mark/1.0/
BP_GT_0008,https://archive.org/details/BP_GT_0008/mode/2up?view=theater,https://archive.org/services/img/BP_GT_0008,"La Fille De Madame Angot; Oil and Vinegar, A Matrimonial Moral",1874-11-30,1874-11-30,Gaiety Theatre,L. H. F. Du Terreaux; Henry J. Byron,comic opera; farce,"English Playbill collection, Bruce Peel Special Collection, University of Alberta Library","Box02, Folder_20",https://archive.org/details/BP_GT_0008,Public domain,https://creativecommons.org/publicdomain/mark/1.0/
BP_RSJT_0002,https://archive.org/details/BP_RSJT_0002/mode/2up?view=theater,https://archive.org/services/img/BP_RSJT_0002,Eclipsing the Sun; The Black Prince,1874-12-18,1874-12-18,Royal St. James Theatre,W. Hartop; H. B. Farnie,comic drama; comedy,"English Playbill collection, Bruce Peel Special Collection, University of Alberta Library","Box04, Folder_47",https://archive.org/details/BP_RSJT_0002,Public domain,https://creativecommons.org/publicdomain/mark/1.0/
BP_GT_0009,https://archive.org/details/BP_GT_0009/mode/2up?view=theater,https://archive.org/services/img/BP_GT_0009,The Bengal Tiger; The Merry Wives of Windsor,1874-12-19,1874-12-19,Gaiety Theatre,Charles Dance; Wm. Shakespeare,comic drama; comedy,"English Playbill collection, Bruce Peel Special Collection, University of Alberta Library","Box02, Folder_20",https://archive.org/details/BP_GT_0009,Public domain,https://creativecommons.org/publicdomain/mark/1.0/
BP_GT_0010,https://archive.org/details/BP_GT_0010/mode/2up?view=theater,https://archive.org/services/img/BP_GT_0010,Money,1875-01-02,1875-01-02,Gaiety Theatre,Lord Lytton,comedy,"English Playbill collection, Bruce Peel Special Collection, University of Alberta Library","Box02, Folder_20",https://archive.org/details/BP_GT_0010,Public domain,https://creativecommons.org/publicdomain/mark/1.0/
BP_VT_0003,https://archive.org/details/BP_VT_0003/mode/2up?view=theater,https://archive.org/services/img/BP_VT_0003,Stage-Land; Good For Nothing!,1875-01-02,1875-01-02,Vaudeville Theatre,G. R. Douglas; Mr. Buckstone,comedy; comic drama,"English Playbill collection, Bruce Peel Special Collection, University of Alberta Library","Box02, Folder_23",https://archive.org/details/BP_VT_0003,Public domain,https://creativecommons.org/publicdomain/mark/1.0/
BP_RAT_0002,https://archive.org/details/BP_RAT_0002/mode/2up?view=theater,https://archive.org/services/img/BP_RAT_0002,The Two Bonnycastles; Whittington,1875-01-11,1875-01-11,Royal Alhambra Theatre,John Maddison Morton; H. B. Farnie,farce; opera bouffe feerie,"English Playbill collection, Bruce Peel Special Collection, University of Alberta Library","Box04, Folder_58",https://archive.org/details/BP_RAT_0002,Public domain,https://creativecommons.org/publicdomain/mark/1.0/
BP_VT_0001,https://archive.org/details/BP_VT_0001/mode/2up?view=theater,https://archive.org/services/img/BP_VT_0001,Cupboard Love; Our Boys; Romulus and Remus,1875-01-16,1875-01-16,Vaudeville Theatre,F. Hay; Henry J. Byron; R. Reece,farce; comedy; burlesque,"English Playbill collection, Bruce Peel Special Collection, University of Alberta Library","Box02, Folder_23",https://archive.org/details/BP_VT_0001,Public domain,https://creativecommons.org/publicdomain/mark/1.0/
BP_HA_0001,https://archive.org/details/BP_HA_0001/mode/2up?view=theater,https://archive.org/services/img/BP_HA_0001,The Irish Emigrant; Blue Beard,1875-02-01,1875-02-01,Holborn Amphitheatre,John Brougham; Offenbach,comic drama; comic opera,"English Playbill collection, Bruce Peel Special Collection, University of Alberta Library","Box03, Folder_29",https://archive.org/details/BP_HA_0001,Public domain,https://creativecommons.org/publicdomain/mark/1.0/
BP_TRDL_0098,https://archive.org/details/BP_TRDL_0098/mode/2up?view=theater,https://archive.org/services/img/BP_TRDL_0098,Special Entertainment by the Moor and Burgess Minstrels for the Benefit of the Royal Dramatic College,1875-02-10,1875-02-10,Theatre Royal in Drury Lane,,,"English Playbill collection, Bruce Peel Special Collection, University of Alberta Library","Box04, Folder_66",https://archive.org/details/BP_TRDL_0098,Public domain,https://creativecommons.org/publicdomain/mark/1.0/
BP_GT_0011,https://archive.org/details/BP_GT_0011/mode/2up?view=theater,https://archive.org/services/img/BP_GT_0011,The Midsummer Night's Dream,1875-02-16,1875-02-16,Gaiety Theatre,Wm. Shakespeare,comedy,"English Playbill collection, Bruce Peel Special Collection, University of Alberta Library","Box02, Folder_20",https://archive.org/details/BP_GT_0011,Public domain,https://creativecommons.org/publicdomain/mark/1.0/
BP_TRDL_0096,https://archive.org/details/BP_TRDL_0096/mode/2up?view=theater,https://archive.org/services/img/BP_TRDL_0096,Othello,1875-04-01,[1875]-04-01,Theatre Royal in Drury Lane,Wm. Shakespeare,tragedy,"English Playbill collection, Bruce Peel Special Collection, University of Alberta Library","Box04, Folder_66",https://archive.org/details/BP_TRDL_0096,Public domain,https://creativecommons.org/publicdomain/mark/1.0/
BP_RCT_0004,https://archive.org/details/BP_RCT_0004/mode/2up?view=theater,https://archive.org/services/img/BP_RCT_0004,All For Her,1875-04-12,[1875-04-12],Royal Court Theatre,J. Palgrave Simpson & Herman Merivale,drama,"English Playbill collection, Bruce Peel Special Collection, University of Alberta Library","Box03, Folder_26",https://archive.org/details/BP_RCT_0004,Public domain,https://creativecommons.org/publicdomain/mark/1.0/
BP_RST_0007,https://archive.org/details/BP_RST_0007/mode/2up?view=theater,https://archive.org/services/img/BP_RST_0007,"Earnest Appeal; Weak Woman; Intimidad, Or, The Lost Regalia",1875-05-06,1875-05-06,Royal Strand Theatre,[unknown]; Henry J. Byron; H. B. Farnie,farce; comedy; musical,"English Playbill collection, Bruce Peel Special Collection, University of Alberta Library","Box03, Folder_36",https://archive.org/details/BP_RST_0007,Public domain,https://creativecommons.org/publicdomain/mark/1.0/
BP_TRDL_0097,https://archive.org/details/BP_TRDL_0097/mode/2up?view=theater,https://archive.org/services/img/BP_TRDL_0097,Hamlet,1875-05-31,[1875]-05-31,Theatre Royal in Drury Lane,Wm. Shakespeare,tragedy,"English Playbill collection, Bruce Peel Special Collection, University of Alberta Library","Box04, Folder_66",https://archive.org/details/BP_TRDL_0097,Public domain,https://creativecommons.org/publicdomain/mark/1.0/
BP_TRDL_0095,https://archive.org/details/BP_TRDL_0095/mode/2up?view=theater,https://archive.org/services/img/BP_TRDL_0095,Hamlet,1875-06-04,[1875]-06-04,[Theatre Royal in Drury Lane],Wm. Shakespeare,tragedy,"English Playbill collection, Bruce Peel Special Collection, University of Alberta Library","Box04, Folder_65",https://archive.org/details/BP_TRDL_0095,Public domain,https://creativecommons.org/publicdomain/mark/1.0/
BP_GT_0012,https://archive.org/details/BP_GT_0012/mode/2up?view=theater,https://archive.org/services/img/BP_GT_0012,Pre Aux Clercs,1875-06-15,1875-06-15,Gaiety Theatre,[unknown],comic opera,"English Playbill collection, Bruce Peel Special Collection, University of Alberta Library","Box02, Folder_20",https://archive.org/details/BP_GT_0012,Public domain,https://creativecommons.org/publicdomain/mark/1.0/
BP_TRB_0001,https://archive.org/details/BP_TRB_0001/mode/2up?view=theater,https://archive.org/services/img/BP_TRB_0001,False Glitter; Anne Boleyn,1875-07-19,1875-07-19,Theatre Royal; Bradford,[unknown]; [unknown],comedy-drama; burlesque,"English Playbill collection, Bruce Peel Special Collection, University of Alberta Library","Box02, Folder_14",https://archive.org/details/BP_TRB_0001,Public domain,https://creativecommons.org/publicdomain/mark/1.0/
BP_GT_0013,https://archive.org/details/BP_GT_0013/mode/2up?view=theater,https://archive.org/services/img/BP_GT_0013,Henry VIII,1875-11-20,1875-11-20,Gaiety Theatre,Wm. Shakespeare,historical play,"English Playbill collection, Bruce Peel Special Collection, University of Alberta Library","Box02, Folder_20",https://archive.org/details/BP_GT_0013,Public domain,https://creativecommons.org/publicdomain/mark/1.0/
BP_GT_0014,https://archive.org/details/BP_GT_0014/mode/2up?view=theater,https://archive.org/services/img/BP_GT_0014,The Merchant of Venice,1876-01-22,1876-01-22,Gaiety Theatre,Wm. Shakespeare,comedy,"English Playbill collection, Bruce Peel Special Collection, University of Alberta Library","Box02, Folder_20",https://archive.org/details/BP_GT_0014,Public domain,https://creativecommons.org/publicdomain/mark/1.0/
BP_ARB_0002,https://archive.org/details/BP_ARB_0002/mode/2up?view=theater,https://archive.org/services/img/BP_ARB_0002,Le Bourgeois Gentilhomme; Merchant of Venice; William Tell; Le Medecin malgre lui,1876-02-01,1876-02-01,Assembly Rooms; Bedford,[unknown]; Wm. Shakespeare; [Schiller]; [unknown],[unknown]; comedy; [unknown]; [unknown],"English Playbill collection, Bruce Peel Special Collection, University of Alberta Library","Box03, Folder_40",https://archive.org/details/BP_ARB_0002,Public domain,https://creativecommons.org/publicdomain/mark/1.0/
BP_TRDL_0094,https://archive.org/details/BP_TRDL_0094/mode/2up?view=theater,https://archive.org/services/img/BP_TRDL_0094,Macbeth,1876-02-04,1876-02-04,Theatre Royal in Drury Lane,Wm. Shakespeare,tragedy,"English Playbill collection, Bruce Peel Special Collection, University of Alberta Library","Box04, Folder_65",https://archive.org/details/BP_TRDL_0094,Public domain,https://creativecommons.org/publicdomain/mark/1.0/
BP_GT_0015,https://archive.org/details/BP_GT_0015/mode/2up?view=theater,https://archive.org/services/img/BP_GT_0015,Twelfth Night,1876-03-11,1876-03-11,Gaiety Theatre,Wm. Shakespeare,comedy,"English Playbill collection, Bruce Peel Special Collection, University of Alberta Library","Box02, Folder_20",https://archive.org/details/BP_GT_0015,Public domain,https://creativecommons.org/publicdomain/mark/1.0/
BP_QTLA_0003,https://archive.org/details/BP_QTLA_0003/mode/2up?view=theater,https://archive.org/services/img/BP_QTLA_0003,"Othello, The Moor of Venice; Macbeth",1876-05-24,[1876-05-24],Queen's Theatre; Long Acre,Wm. Shakespeare; Wm. Shakespeare,tragedy; tragedy,"English Playbill collection, Bruce Peel Special Collection, University of Alberta Library","Box02, Folder_25",https://archive.org/details/BP_QTLA_0003,Public domain,https://creativecommons.org/publicdomain/mark/1.0/
BP_GT_0016,https://archive.org/details/BP_GT_0016/mode/2up?view=theater,https://archive.org/services/img/BP_GT_0016,Blue Devil; My Awful Dad; Cool as a Cucumber,1876-06-05,1876-06-05,Gaiety Theatre,"G. Coleman, the Younger; Charles Mathews; Blanchard Jerrold",comic drama; comedy; farce,"English Playbill collection, Bruce Peel Special Collection, University of Alberta Library","Box02, Folder_20",https://archive.org/details/BP_GT_0016,Public domain,https://creativecommons.org/publicdomain/mark/1.0/
BP_BGT_0002,https://archive.org/details/BP_BGT_0002/mode/2up?view=theater,https://archive.org/services/img/BP_BGT_0002,Falsely Accused!; Gra-Gal-Machree,1876-08-07,1876-08-07,Britannia; The Great Theatre; Hoxton,J. Cherry Griffiths; Barry Connor,drama; hibernian drama,"English Playbill collection, Bruce Peel Special Collection, University of Alberta Library","Box03, Folder_31",https://archive.org/details/BP_BGT_0002,Public domain,https://creativecommons.org/publicdomain/mark/1.0/
BP_TRDL_0092,https://archive.org/details/BP_TRDL_0092/mode/2up?view=theater,https://archive.org/services/img/BP_TRDL_0092,Richard III; That Beautiful Biceps; The Storm Fiend,1876-09-23,[1876]-09-23,Theatre Royal in Drury Lane,Wm. Shakespeare; H. Savil Clarke; Messrs. Charles and Henry Lauri,tragedy; anatomical eccentricity; grand ballet of action,"English Playbill collection, Bruce Peel Special Collection, University of Alberta Library","Box04, Folder_65",https://archive.org/details/BP_TRDL_0092,Public domain,https://creativecommons.org/publicdomain/mark/1.0/
BP_MT_0001,https://archive.org/details/BP_MT_0001/mode/2up?view=theater,https://archive.org/services/img/BP_MT_0001,Night & Morn; Flying Dutchman,1876-11-18,[1876]-11-18,Marylebone Theatre,Bulwer Lytton; [unknown],drama; great adelphi spectral,"English Playbill collection, Bruce Peel Special Collection, University of Alberta Library","Box03, Folder_37",https://archive.org/details/BP_MT_0001,Public domain,https://creativecommons.org/publicdomain/mark/1.0/
BP_TRDL_0091,https://archive.org/details/BP_TRDL_0091/mode/2up?view=theater,https://archive.org/services/img/BP_TRDL_0091,Macbeth; That Beautiful Biceps; The Storm Fiend,1876-11-22,1876-11-22,Theatre Royal in Drury Lane,Wm. Shakespeare; H. Savil Clarke; Messrs. Charles and Henry Lauri,tragedy; anatomical eccentricity; grand ballet of action,"English Playbill collection, Bruce Peel Special Collection, University of Alberta Library","Box04, Folder_65",https://archive.org/details/BP_TRDL_0091,Public domain,https://creativecommons.org/publicdomain/mark/1.0/
BP_RSJT_0004,https://archive.org/details/BP_RSJT_0004/mode/2up?view=theater,https://archive.org/services/img/BP_RSJT_0004,London Assurance; Nilsson Or Nothing,1876-12-02,1876-12-02,Royal St. James Theatre,[unknown]; [unknown],comedy; comic sketch,"English Playbill collection, Bruce Peel Special Collection, University of Alberta Library","Box04, Folder_47",https://archive.org/details/BP_RSJT_0004,Public domain,https://creativecommons.org/publicdomain/mark/1.0/
BP_ROT_0009,https://archive.org/details/BP_ROT_0009/mode/2up?view=theater,https://archive.org/services/img/BP_ROT_0009,Crazed; No Thoroughfare,1876-12-07,1876-12-07,Royal Olympic Theatre,Alfred Phillips; Charles Dickens and Wilkie Collins,musical absurdity; drama,"English Playbill collection, Bruce Peel Special Collection, University of Alberta Library","Box03, Folder_35",https://archive.org/details/BP_ROT_0009,Public domain,https://creativecommons.org/publicdomain/mark/1.0/
BP_MT_0002,https://archive.org/details/BP_MT_0002/mode/2up?view=theater,https://archive.org/services/img/BP_MT_0002,Hamlet; The Seaman's Star,1876-12-11,[1876]-12-11,Marylebone Theatre,Wm. Shakespeare; Edward Stirling,tragedy; nautical drama,"English Playbill collection, Bruce Peel Special Collection, University of Alberta Library","Box03, Folder_37",https://archive.org/details/BP_MT_0002,Public domain,https://creativecommons.org/publicdomain/mark/1.0/
BP_RLT_0078,https://archive.org/details/BP_RLT_0078/mode/2up?view=theater,https://archive.org/services/img/BP_RLT_0078,Macbeth; Diamond Cut Diamond,1876-12-16,1876-12-16,Royal Lyceum Theatre,Wm. Shakespeare; [unknown],tragedy; farce,"English Playbill collection, Bruce Peel Special Collection, University of Alberta Library","Box03, Folder_44",https://archive.org/details/BP_RLT_0078,Public domain,https://creativecommons.org/publicdomain/mark/1.0/
BP_ARB_0001,https://archive.org/details/BP_ARB_0001/mode/2up?view=theater,https://archive.org/services/img/BP_ARB_0001,Scenes from Moliere's Les Fourberies de Scapin; Hamlet; The Maid of Orleans,1876-12-22,1876-12-22,Assembly Rooms; Bedford,Moliere; Wm. Shakespeare; Schiller,comedy; tragedy; tragedy,"English Playbill collection, Bruce Peel Special Collection, University of Alberta Library","Box03, Folder_40",https://archive.org/details/BP_ARB_0001,Public domain,https://creativecommons.org/publicdomain/mark/1.0/
BP_SW_0004,https://archive.org/details/BP_SW_0004/mode/2up?view=theater,https://archive.org/services/img/BP_SW_0004,Grand Science Festival,1877-01-08,1877-01-08,[Theatre Royal] [New] Sadler's Wells,Professor Pepper,scientific demonstration,"English Playbill collection, Bruce Peel Special Collection, University of Alberta Library","Box03, Folder_39",https://archive.org/details/BP_SW_0004,Public domain,https://creativecommons.org/publicdomain/mark/1.0/
BP_TRDL_0089,https://archive.org/details/BP_TRDL_0089/mode/2up?view=theater,https://archive.org/services/img/BP_TRDL_0089,Hide & Seek; Harlequin and the Forty Thieves,1877-01-15,1877-01-15,Theatre Royal in Drury Lane,[unknown]; [unknown],farce; grand comic christmas annual,"English Playbill collection, Bruce Peel Special Collection, University of Alberta Library","Box04, Folder_65",https://archive.org/details/BP_TRDL_0089,Public domain,https://creativecommons.org/publicdomain/mark/1.0/
BP_TRDL_0090,https://archive.org/details/BP_TRDL_0090/mode/2up?view=theater,https://archive.org/services/img/BP_TRDL_0090,Hide & Seek; Harlequin and the Forty Thieves,1877-01-15,1877-01-15,Theatre Royal in Drury Lane,[unknown]; [unknown],farce; grand comic christmas annual,"English Playbill collection, Bruce Peel Special Collection, University of Alberta Library","Box04, Folder_65",https://archive.org/details/BP_TRDL_0090,Public domain,https://creativecommons.org/publicdomain/mark/1.0/
BP_RSJT_0005,https://archive.org/details/BP_RSJT_0005/mode/2up?view=theater,https://archive.org/services/img/BP_RSJT_0005,The Danischeffs; A Wife's First Lesson,1877-01-27,1877-01-27,Royal St. James Theatre,[unknown]; [unknown],[unknown]; farce,"English Playbill collection, Bruce Peel Special Collection, University of Alberta Library","Box04, Folder_47",https://archive.org/details/BP_RSJT_0005,Public domain,https://creativecommons.org/publicdomain/mark/1.0/
BP_RLT_0073,https://archive.org/details/BP_RLT_0073/mode/2up?view=theater,https://archive.org/services/img/BP_RLT_0073,King Richard III; Matrimony,1877-01-30,[1877-01-30],Royal Lyceum Theatre,Wm. Shakespeare; [unknown],tragedy; comedy,"English Playbill collection, Bruce Peel Special Collection, University of Alberta Library","Box03, Folder_44",https://archive.org/details/BP_RLT_0073,Public domain,https://creativecommons.org/publicdomain/mark/1.0/
BP_RCT_0005,https://archive.org/details/BP_RCT_0005/mode/2up?view=theater,https://archive.org/services/img/BP_RCT_0005,New Men and Old Acres,1877-03-15,[1877-03-15],Royal Court Theatre,Tom Taylor & A. W. Dubourg,comedy,"English Playbill collection, Bruce Peel Special Collection, University of Alberta Library","Box03, Folder_26",https://archive.org/details/BP_RCT_0005,Public domain,https://creativecommons.org/publicdomain/mark/1.0/
BP_TRE_0001,https://archive.org/details/BP_TRE_0001/mode/2up?view=theater,https://archive.org/services/img/BP_TRE_0001,"Kerry; Or, Night and Morning; Not such a Fool as he Looks;",1877-04-02,1877-04-02,Theatre Royal [Edinburgh],Dion Boucicault; H. J. Byron,drama; eccentric comedy,"English Playbill collection, Bruce Peel Special Collection, University of Alberta Library","Box04, Folder_48",https://archive.org/details/BP_TRE_0001,Public domain,https://creativecommons.org/publicdomain/mark/1.0/
