objectid,filename,image_thumb,title,date,field-date,theatre-name,playwright,subject,source,location,url,rights,rightsstatement
BP_TRDL_0012,https://archive.org/details/BP_TRDL_0012/mode/2up?view=theater,https://archive.org/services/img/BP_TRDL_0012,"School for Scandal; The Valley of Diamonds; Or, Harlequin Sinbad",1815-01-18,1815-01-18,Theatre Royal in Drury Lane,[unknown]; Messrs Kirby and Morris,comedy; pantomime,"English Playbill collection, Bruce Peel Special Collection, University of Alberta Library","Box01, Folder_05",https://archive.org/details/BP_TRDL_0012,Public domain,https://creativecommons.org/publicdomain/mark/1.0/
BP_TRDL_0013,https://archive.org/details/BP_TRDL_0013/mode/2up?view=theater,https://archive.org/services/img/BP_TRDL_0013,"All in the Wrong; The Valley of Diamonds: Or, Harlequin Sinbad",1815-01-20,1815-01-20,Theatre Royal in Drury Lane,Murphy; Messrs Kirby and Morris,comedy; pantomime,"English Playbill collection, Bruce Peel Special Collection, University of Alberta Library","Box01, Folder_05",https://archive.org/details/BP_TRDL_0013,Public domain,https://creativecommons.org/publicdomain/mark/1.0/
BP_TRDL_0014,https://archive.org/details/BP_TRDL_0014/mode/2up?view=theater,https://archive.org/services/img/BP_TRDL_0014,"School for Scandal; The Valley of Diamonds; Or, Harlequin Sinbad",1815-01-25,1815-01-25,Theatre Royal in Drury Lane,[unknown]; Messrs Kirby and Morris,comedy; pantomime,"English Playbill collection, Bruce Peel Special Collection, University of Alberta Library","Box01, Folder_05",https://archive.org/details/BP_TRDL_0014,Public domain,https://creativecommons.org/publicdomain/mark/1.0/
BP_TRDL_0015,https://archive.org/details/BP_TRDL_0015/mode/2up?view=theater,https://archive.org/services/img/BP_TRDL_0015,"Jean de Paris; The Birth-day; The Valley of Diamonds; Or, Harlequin Sinbad",1815-01-26,1815-01-26,Theatre Royal in Drury Lane,[unknown]; T. J. Dibdin; Messrs Kirby and Morris,comic drama; comedy; pantomime,"English Playbill collection, Bruce Peel Special Collection, University of Alberta Library","Box01, Folder_05",https://archive.org/details/BP_TRDL_0015,Public domain,https://creativecommons.org/publicdomain/mark/1.0/
BP_TRDL_0016,https://archive.org/details/BP_TRDL_0016/mode/2up?view=theater,https://archive.org/services/img/BP_TRDL_0016,"All in the Wrong; The Valley of Diamonds: Or, Harlequin Sinbad",1815-01-27,1815-01-27,Theatre Royal in Drury Lane,Murphy; Messrs Kirby and Morris,comedy; pantomime,"English Playbill collection, Bruce Peel Special Collection, University of Alberta Library","Box01, Folder_05",https://archive.org/details/BP_TRDL_0016,Public domain,https://creativecommons.org/publicdomain/mark/1.0/
BP_TRDL_0017,https://archive.org/details/BP_TRDL_0017/mode/2up?view=theater,https://archive.org/services/img/BP_TRDL_0017,"The Provok'd Husband; The Valley of Diamonds: Or, Harlequin Sinbad",1815-02-03,1815-02-03,Theatre Royal in Drury Lane,[unknown]; Messrs Kirby and Morris,comedy; pantomime,"English Playbill collection, Bruce Peel Special Collection, University of Alberta Library","Box01, Folder_05",https://archive.org/details/BP_TRDL_0017,Public domain,https://creativecommons.org/publicdomain/mark/1.0/
BP_TRDL_0018,https://archive.org/details/BP_TRDL_0018/mode/2up?view=theater,https://archive.org/services/img/BP_TRDL_0018,Second part of The Messiah; Selection from Acis & Galatea; A Grand Selection,1815-02-15,1815-02-15,Theatre Royal in Drury Lane,Handel; Handel; Assorted Composers,musical performance; musical performance; musical performance,"English Playbill collection, Bruce Peel Special Collection, University of Alberta Library","Box01, Folder_05",https://archive.org/details/BP_TRDL_0018,Public domain,https://creativecommons.org/publicdomain/mark/1.0/
BP_TRDL_0019,https://archive.org/details/BP_TRDL_0019/mode/2up?view=theater,https://archive.org/services/img/BP_TRDL_0019,The West Indian; The Children in the Wood,1815-03-07,1815-03-07,Theatre Royal in Drury Lane,R. Cumberland; [unknown],comedy; [unknown],"English Playbill collection, Bruce Peel Special Collection, University of Alberta Library","Box01, Folder_05",https://archive.org/details/BP_TRDL_0019,Public domain,https://creativecommons.org/publicdomain/mark/1.0/
BP_TRDL_0020,https://archive.org/details/BP_TRDL_0020/mode/2up?view=theater,https://archive.org/services/img/BP_TRDL_0020,King Richard II; Past Ten o'Clock! and a Rainy Night,1815-03-11,1815-03-11,Theatre Royal in Drury Lane,Wm. Shakespeare; [unknown],tragedy; farce,"English Playbill collection, Bruce Peel Special Collection, University of Alberta Library","Box01, Folder_05",https://archive.org/details/BP_TRDL_0020,Public domain,https://creativecommons.org/publicdomain/mark/1.0/
BP_TRDL_0021,https://archive.org/details/BP_TRDL_0021/mode/2up?view=theater,https://archive.org/services/img/BP_TRDL_0021,Siege of Belgrade; Jean de Paris,1815-03-18,1815-03-18,Theatre Royal in Drury Lane,[unknown]; [unknown],comic opera; comic drama,"English Playbill collection, Bruce Peel Special Collection, University of Alberta Library","Box01, Folder_05",https://archive.org/details/BP_TRDL_0021,Public domain,https://creativecommons.org/publicdomain/mark/1.0/
BP_TRDL_0022,https://archive.org/details/BP_TRDL_0022/mode/2up?view=theater,https://archive.org/services/img/BP_TRDL_0022,Siege of Belgrade; Past Ten o'Clock! and a Rainy Night,1815-03-18,1815-03-18,Theatre Royal in Drury Lane,[unknown]; [unknown],comic opera; farce,"English Playbill collection, Bruce Peel Special Collection, University of Alberta Library","Box01, Folder_05",https://archive.org/details/BP_TRDL_0022,Public domain,https://creativecommons.org/publicdomain/mark/1.0/
BP_TRDL_0023,https://archive.org/details/BP_TRDL_0023/mode/2up?view=theater,https://archive.org/services/img/BP_TRDL_0023,"Jean de Paris; Pas Ten o'Clock! and a Rainy Night; The Valley of Diamonds; Or, Harlequin Sinbad",1815-03-27,1815-03-27,Theatre Royal in Drury Lane,[unknown]; [unknown]; Messrs Kirby and Morris,comic drama; farce; pantomime,"English Playbill collection, Bruce Peel Special Collection, University of Alberta Library","Box01, Folder_05",https://archive.org/details/BP_TRDL_0023,Public domain,https://creativecommons.org/publicdomain/mark/1.0/
BP_TRDL_0024,https://archive.org/details/BP_TRDL_0024/mode/2up?view=theater,https://archive.org/services/img/BP_TRDL_0024,The Unknown Guest; Past Ten o'Clock! and a Rainy Night,1815-03-31,1815-03-31,Theatre Royal in Drury Lane,Kelly and Braham; [unknown],operatic drama; farce,"English Playbill collection, Bruce Peel Special Collection, University of Alberta Library","Box01, Folder_05",https://archive.org/details/BP_TRDL_0024,Public domain,https://creativecommons.org/publicdomain/mark/1.0/
BP_TRDL_0043,https://archive.org/details/BP_TRDL_0043/mode/2up?view=theater,https://archive.org/services/img/BP_TRDL_0043,The Unknown Guest; Past Ten o'Clock! and a Rainy Night,1815-04-06,1815-04-06,Theatre Royal in Drury Lane,Kelly and Braham; [unknown],operatic drama; farce,"English Playbill collection, Bruce Peel Special Collection, University of Alberta Library","Box01, Folder_06",https://archive.org/details/BP_TRDL_0043,Public domain,https://creativecommons.org/publicdomain/mark/1.0/
BP_TRDL_0044,https://archive.org/details/BP_TRDL_0044/mode/2up?view=theater,https://archive.org/services/img/BP_TRDL_0044,Mount of Olives; A Grand Selection; Liberation of Germany; Grand Battle Sinfonia,1815-05-13,1815-05-13,Theatre Royal in Drury Lane,Beethoven; Assorted Composers; [unknown]; Beethoven,musical performance; musical performance; musical performance; musical performance,"English Playbill collection, Bruce Peel Special Collection, University of Alberta Library","Box01, Folder_06",https://archive.org/details/BP_TRDL_0044,Public domain,https://creativecommons.org/publicdomain/mark/1.0/
BP_TRDL_0045,https://archive.org/details/BP_TRDL_0045/mode/2up?view=theater,https://archive.org/services/img/BP_TRDL_0045,School for Scandal; Gallimaufry; The Woodman's Hut,1815-06-21,1815-06-21,Theatre Royal in Drury Lane,[unknown]; Various playwrights; [unknown],comedy; performance; melodrama,"English Playbill collection, Bruce Peel Special Collection, University of Alberta Library","Box01, Folder_06",https://archive.org/details/BP_TRDL_0045,Public domain,https://creativecommons.org/publicdomain/mark/1.0/
BP_TRDL_0046,https://archive.org/details/BP_TRDL_0046/mode/2up?view=theater,https://archive.org/services/img/BP_TRDL_0046,The Peasant Boy; Chrononhotonthologos; The Woodman's Hut,1815-06-30,1815-06-30,Theatre Royal in Drury Lane,[unknown]; [unknown]; [unknown],operatic drama; tragedy; melodrama,"English Playbill collection, Bruce Peel Special Collection, University of Alberta Library","Box01, Folder_06",https://archive.org/details/BP_TRDL_0046,Public domain,https://creativecommons.org/publicdomain/mark/1.0/
BP_TRCG_0024,https://archive.org/details/BP_TRCG_0024/mode/2up?view=theater,https://archive.org/services/img/BP_TRCG_0024,What's A Man Of Fashion?; Cymon; Mrs. Wiggins,1815-11-29,1815-11-29,Theatre Royal; Covent Garden,[unknown]; D. Garrick; [unknown],comedy; dramatic romance; farce,"English Playbill collection, Bruce Peel Special Collection, University of Alberta Library","Box02, Folder_07",https://archive.org/details/BP_TRCG_0024,Public domain,https://creativecommons.org/publicdomain/mark/1.0/
BP_TRCG_0025,https://archive.org/details/BP_TRCG_0025/mode/2up?view=theater,https://archive.org/services/img/BP_TRCG_0025,"Romeo and Juliet; Harlequin & Fortunio; Or, Shing-Moo and Thun-Ton",1816-01-15,1816-01-15,Theatre Royal; Covent Garden,Wm. Shakespeare; Mr. Ware,tragedy; pantomime,"English Playbill collection, Bruce Peel Special Collection, University of Alberta Library","Box02, Folder_07",https://archive.org/details/BP_TRCG_0025,Public domain,https://creativecommons.org/publicdomain/mark/1.0/
BP_TRDL_0047,https://archive.org/details/BP_TRDL_0047/mode/2up?view=theater,https://archive.org/services/img/BP_TRDL_0047,The Recruiting Officer; The Poor Soldier,1816-02-27,1816-02-27,Theatre Royal in Drury Lane,Farquhar; J. O'Keeffe,comedy; musical farce,"English Playbill collection, Bruce Peel Special Collection, University of Alberta Library","Box01, Folder_06",https://archive.org/details/BP_TRDL_0047,Public domain,https://creativecommons.org/publicdomain/mark/1.0/
BP_TRCG_0026,https://archive.org/details/BP_TRCG_0026/mode/2up?view=theater,https://archive.org/services/img/BP_TRCG_0026,Venice Preserved; The Miller & His Men,1816-03-11,1816-03-11,Theatre Royal; Covent Garden,[unknown]; [unknown],tragedy; melodrama,"English Playbill collection, Bruce Peel Special Collection, University of Alberta Library","Box02, Folder_07",https://archive.org/details/BP_TRCG_0026,Public domain,https://creativecommons.org/publicdomain/mark/1.0/
BP_TRCG_0027,https://archive.org/details/BP_TRCG_0027/mode/2up?view=theater,https://archive.org/services/img/BP_TRCG_0027,The School for Scandal; The Miller & His Men,1816-04-04,1816-04-04,Theatre Royal; Covent Garden,R. B. Sheridan; [unknown],comedy; melodrama,"English Playbill collection, Bruce Peel Special Collection, University of Alberta Library","Box02, Folder_07",https://archive.org/details/BP_TRCG_0027,Public domain,https://creativecommons.org/publicdomain/mark/1.0/
BP_TRCG_0028,https://archive.org/details/BP_TRCG_0028/mode/2up?view=theater,https://archive.org/services/img/BP_TRCG_0028,The School for Scandal; John of Paris,1816-04-06,1816-04-06,Theatre Royal; Covent Garden,R. B. Sheridan; [unknown],comedy; opera,"English Playbill collection, Bruce Peel Special Collection, University of Alberta Library","Box02, Folder_07",https://archive.org/details/BP_TRCG_0028,Public domain,https://creativecommons.org/publicdomain/mark/1.0/
BP_TRCG_0029,https://archive.org/details/BP_TRCG_0029/mode/2up?view=theater,https://archive.org/services/img/BP_TRCG_0029,The School for Scandal; The Bee Hive,1816-05-26,1816-05-26,Theatre Royal; Covent Garden,R. B. Sheridan; [unknown],comedy; farce,"English Playbill collection, Bruce Peel Special Collection, University of Alberta Library","Box02, Folder_07",https://archive.org/details/BP_TRCG_0029,Public domain,https://creativecommons.org/publicdomain/mark/1.0/
BP_TRDL_0048,https://archive.org/details/BP_TRDL_0048/mode/2up?view=theater,https://archive.org/services/img/BP_TRDL_0048,"Othello, the Moor of Venice; Raising the Wind",1816-09-30,1816-09-30,Theatre Royal in Drury Lane,Wm. Shakespeare; [unknown],tragedy; farce,"English Playbill collection, Bruce Peel Special Collection, University of Alberta Library","Box01, Folder_06",https://archive.org/details/BP_TRDL_0048,Public domain,https://creativecommons.org/publicdomain/mark/1.0/
BP_TRCG_0001,https://archive.org/details/BP_TRCG_0001/mode/2up?view=theater,https://archive.org/services/img/BP_TRCG_0001,"Coriolanus; Or, The Roman Matron; The Broken Sword",1816-11-19,1816-11-19,Theatre Royal; Covent Garden,Wm. Shakespeare; [unknown],tragedy; melodrama,"English Playbill collection, Bruce Peel Special Collection, University of Alberta Library","Box02, Folder_07",https://archive.org/details/BP_TRCG_0001,Public domain,https://creativecommons.org/publicdomain/mark/1.0/
BP_TRCG_0067,https://archive.org/details/BP_TRCG_0067/mode/2up?view=theater,https://archive.org/services/img/BP_TRCG_0067,"The Humorous Lieutenant, Or, Alexander's Successors; Harlequin and the Sylph of the Oak: Or, the Blind Beggar of Bethnal Green",1817-01-24,1817-01-24,Theatre Royal; Covent Garden,Beaumont and Fletcher; [unknown],[unknown]; grand pantomime,"English Playbill collection, Bruce Peel Special Collection, University of Alberta Library","Box04, Folder_62",https://archive.org/details/BP_TRCG_0067,Public domain,https://creativecommons.org/publicdomain/mark/1.0/
BP_TRDL_0049,https://archive.org/details/BP_TRDL_0049/mode/2up?view=theater,https://archive.org/services/img/BP_TRDL_0049,The Iron Chest; Frighten'd to Death,1817-03-01,1817-03-01,Theatre Royal in Drury Lane,[unknown]; [unknown],play; musical entertainment,"English Playbill collection, Bruce Peel Special Collection, University of Alberta Library","Box01, Folder_06",https://archive.org/details/BP_TRDL_0049,Public domain,https://creativecommons.org/publicdomain/mark/1.0/
BP_TRDL_0050,https://archive.org/details/BP_TRDL_0050/mode/2up?view=theater,https://archive.org/services/img/BP_TRDL_0050,Macbeth; The Inn-keeper's Daughter,1817-05-02,1817-05-02,Theatre Royal in Drury Lane,Wm. Shakespeare; [unknown],tragedy; melodrama,"English Playbill collection, Bruce Peel Special Collection, University of Alberta Library","Box01, Folder_06",https://archive.org/details/BP_TRDL_0050,Public domain,https://creativecommons.org/publicdomain/mark/1.0/
BP_TRCG_0083,https://archive.org/details/BP_TRCG_0083/mode/2up?view=theater,https://archive.org/services/img/BP_TRCG_0083,The Revenge; The Libertine,1817-05-22,1817-05-22,Theatre Royal; Covent Garden,[unknown]; [unknown],tragedy; operatic drama,"English Playbill collection, Bruce Peel Special Collection, University of Alberta Library","Oversize01, Folder_63",https://archive.org/details/BP_TRCG_0083,Public domain,https://creativecommons.org/publicdomain/mark/1.0/
BP_TRCG_0068,https://archive.org/details/BP_TRCG_0068/mode/2up?view=theater,https://archive.org/services/img/BP_TRCG_0068,Coriolanus; The Libertine,1817-05-23,1817-05-23,Theatre Royal; Covent Garden,Wm. Shakespeare; [unknown],tragedy; operatic drama,"English Playbill collection, Bruce Peel Special Collection, University of Alberta Library","Box04, Folder_62",https://archive.org/details/BP_TRCG_0068,Public domain,https://creativecommons.org/publicdomain/mark/1.0/
BP_TRCG_0069,https://archive.org/details/BP_TRCG_0069/mode/2up?view=theater,https://archive.org/services/img/BP_TRCG_0069,The Mountaineers; The Libertine,1817-05-29,1817-05-29,Theatre Royal; Covent Garden,[unknown]; [unknown],[unknown]; operatic drama,"English Playbill collection, Bruce Peel Special Collection, University of Alberta Library","Box04, Folder_62",https://archive.org/details/BP_TRCG_0069,Public domain,https://creativecommons.org/publicdomain/mark/1.0/
BP_TRCG_0070,https://archive.org/details/BP_TRCG_0070/mode/2up?view=theater,https://archive.org/services/img/BP_TRCG_0070,Julius Caesar; The Libertine,1817-05-31,1817-05-31,Theatre Royal; Covent Garden,Wm. Shakespeare; [unknown],tragedy; operatic drama,"English Playbill collection, Bruce Peel Special Collection, University of Alberta Library","Box04, Folder_62",https://archive.org/details/BP_TRCG_0070,Public domain,https://creativecommons.org/publicdomain/mark/1.0/
BP_TRCG_0071,https://archive.org/details/BP_TRCG_0071/mode/2up?view=theater,https://archive.org/services/img/BP_TRCG_0071,"First Part of King Henry the Fourth; No Song, No Supper; Aurora; Or, The Flight of Zephyr",1817-06-03,1817-06-03,Theatre Royal; Covent Garden,Wm. Shakespeare; [unknown]; Mr. Noels,[unknown]; musical farce; ballet divertisement,"English Playbill collection, Bruce Peel Special Collection, University of Alberta Library","Box04, Folder_62",https://archive.org/details/BP_TRCG_0071,Public domain,https://creativecommons.org/publicdomain/mark/1.0/
BP_TRCG_0072,https://archive.org/details/BP_TRCG_0072/mode/2up?view=theater,https://archive.org/services/img/BP_TRCG_0072,Cato; The Libertine,1817-06-04,1817-06-04,Theatre Royal; Covent Garden,[unknown]; [unknown],tragedy; operatic drama,"English Playbill collection, Bruce Peel Special Collection, University of Alberta Library","Box04, Folder_62",https://archive.org/details/BP_TRCG_0072,Public domain,https://creativecommons.org/publicdomain/mark/1.0/
BP_TRCG_0073,https://archive.org/details/BP_TRCG_0073/mode/2up?view=theater,https://archive.org/services/img/BP_TRCG_0073,Macbeth; Raising the Wind,1817-06-05,1817-06-05,Theatre Royal; Covent Garden,Wm. Shakespeare; [unknown],tragedy; farce,"English Playbill collection, Bruce Peel Special Collection, University of Alberta Library","Box04, Folder_62",https://archive.org/details/BP_TRCG_0073,Public domain,https://creativecommons.org/publicdomain/mark/1.0/
BP_TRCG_0074,https://archive.org/details/BP_TRCG_0074/mode/2up?view=theater,https://archive.org/services/img/BP_TRCG_0074,"The Stranger; No Song, No Supper",1817-06-21,1817-06-21,Theatre Royal; Covent Garden,[unknown]; [unknown],[unknown]; musical farce,"English Playbill collection, Bruce Peel Special Collection, University of Alberta Library","Box04, Folder_62",https://archive.org/details/BP_TRCG_0074,Public domain,https://creativecommons.org/publicdomain/mark/1.0/
BP_TRCG_0030,https://archive.org/details/BP_TRCG_0030/mode/2up?view=theater,https://archive.org/services/img/BP_TRCG_0030,The Stranger; The Libertine,1817-10-22,1817-10-22,Theatre Royal; Covent Garden,[unknown]; Mr. Bishop,[unknown]; operatic drama,"English Playbill collection, Bruce Peel Special Collection, University of Alberta Library","Box02, Folder_07",https://archive.org/details/BP_TRCG_0030,Public domain,https://creativecommons.org/publicdomain/mark/1.0/
BP_TRCG_0075,https://archive.org/details/BP_TRCG_0075/mode/2up?view=theater,https://archive.org/services/img/BP_TRCG_0075,"Retribution; Or, The Chieftain's Daughter; Harlequin Gulliver, or, The Flying Island",1818-01-12,1818-01-12,Theatre Royal; Covent Garden,[unknown]; [unknown],tragedy; pantomime,"English Playbill collection, Bruce Peel Special Collection, University of Alberta Library","Box04, Folder_62",https://archive.org/details/BP_TRCG_0075,Public domain,https://creativecommons.org/publicdomain/mark/1.0/
BP_TRCG_0031,https://archive.org/details/BP_TRCG_0031/mode/2up?view=theater,https://archive.org/services/img/BP_TRCG_0031,The Stranger; The Miller & His Men,1818-05-13,1818-05-13,Theatre Royal; Covent Garden,[unknown]; [unknown],[unknown]; melodrama,"English Playbill collection, Bruce Peel Special Collection, University of Alberta Library","Box02, Folder_07",https://archive.org/details/BP_TRCG_0031,Public domain,https://creativecommons.org/publicdomain/mark/1.0/
BP_TRCG_0076,https://archive.org/details/BP_TRCG_0076/mode/2up?view=theater,https://archive.org/services/img/BP_TRCG_0076,"Pizarro; Blue Beard; Or, Female Curiosity",1818-06-05,1818-06-05,Theatre Royal; Covent Garden,[unknown]; [unknown],tragedy; dramatic romance,"English Playbill collection, Bruce Peel Special Collection, University of Alberta Library","Box04, Folder_62",https://archive.org/details/BP_TRCG_0076,Public domain,https://creativecommons.org/publicdomain/mark/1.0/
BP_TRCG_0032,https://archive.org/details/BP_TRCG_0032/mode/2up?view=theater,https://archive.org/services/img/BP_TRCG_0032,The Merchant of Venice; Rosina,1818-07-04,1818-07-04,Theatre Royal; Covent Garden,Wm. Shakespeare; F. Brooke,comedy; farce,"English Playbill collection, Bruce Peel Special Collection, University of Alberta Library","Box02, Folder_07",https://archive.org/details/BP_TRCG_0032,Public domain,https://creativecommons.org/publicdomain/mark/1.0/
BP_TRCG_0033,https://archive.org/details/BP_TRCG_0033/mode/2up?view=theater,https://archive.org/services/img/BP_TRCG_0033,"The Clandestine Marriage; Love, Law, & Physick",1818-10-07,1818-10-07,Theatre Royal; Covent Garden,[unknown]; [unknown],comedy; farce,"English Playbill collection, Bruce Peel Special Collection, University of Alberta Library","Box02, Folder_07",https://archive.org/details/BP_TRCG_0033,Public domain,https://creativecommons.org/publicdomain/mark/1.0/
BP_TRCG_0034,https://archive.org/details/BP_TRCG_0034/mode/2up?view=theater,https://archive.org/services/img/BP_TRCG_0034,Fazio; The Wedding Day; The Sleep Walker,1818-10-27,1818-10-27,Theatre Royal; Covent Garden,[unknown]; [unknown]; [unknown],tragedy; comedy; farce,"English Playbill collection, Bruce Peel Special Collection, University of Alberta Library","Box02, Folder_07",https://archive.org/details/BP_TRCG_0034,Public domain,https://creativecommons.org/publicdomain/mark/1.0/
BP_TRCG_0035,https://archive.org/details/BP_TRCG_0035/mode/2up?view=theater,https://archive.org/services/img/BP_TRCG_0035,The Clandestine Marriage; The Barber of Seville,1818-11-10,1818-11-10,Theatre Royal; Covent Garden,[unknown]; Rossini,comedy; comic opera,"English Playbill collection, Bruce Peel Special Collection, University of Alberta Library","Box02, Folder_07",https://archive.org/details/BP_TRCG_0035,Public domain,https://creativecommons.org/publicdomain/mark/1.0/
BP_TRCG_0036,https://archive.org/details/BP_TRCG_0036/mode/2up?view=theater,https://archive.org/services/img/BP_TRCG_0036,The Earl of Warwick; The Wedding Day; The Libertine,1818-12-11,1818-12-11,Theatre Royal; Covent Garden,[unknown]; [unknown]; Mr. Bishop,tragedy; comedy; operatic drama,"English Playbill collection, Bruce Peel Special Collection, University of Alberta Library","Box02, Folder_08",https://archive.org/details/BP_TRCG_0036,Public domain,https://creativecommons.org/publicdomain/mark/1.0/
BP_TRCG_0077,https://archive.org/details/BP_TRCG_0077/mode/2up?view=theater,https://archive.org/services/img/BP_TRCG_0077,"Jane Shore; Harlequin Munchausen, or, The Fountain of Love",1818-12-28,1818-12-28,Theatre Royal; Covent Garden,[unknown]; [unknown],tragedy; grand pantomime,"English Playbill collection, Bruce Peel Special Collection, University of Alberta Library","Box04, Folder_62",https://archive.org/details/BP_TRCG_0077,Public domain,https://creativecommons.org/publicdomain/mark/1.0/
BP_TRH_0158,https://archive.org/details/BP_TRH_0158/mode/2up?view=theater,https://archive.org/services/img/BP_TRH_0158,Richard III; The Sleeping Draught,1819-01-04,1819-01-04,Theatre Royal; Hull,Wm. Shakespeare; [unknown],historical; [unknown],"English Playbill collection, Bruce Peel Special Collection, University of Alberta Library","Box01, Folder_04",https://archive.org/details/BP_TRH_0158,Public domain,https://creativecommons.org/publicdomain/mark/1.0/
BP_TRH_0159,https://archive.org/details/BP_TRH_0159/mode/2up?view=theater,https://archive.org/services/img/BP_TRH_0159,"Hamlet, Prince of Denmark; Love Laughs at Locksmiths",1819-01-05,1819-01-05,Theatre Royal; Hull,Wm. Shakespeare; G. Colman,tragedy; comedy,"English Playbill collection, Bruce Peel Special Collection, University of Alberta Library","Box01, Folder_04",https://archive.org/details/BP_TRH_0159,Public domain,https://creativecommons.org/publicdomain/mark/1.0/
BP_TRH_0160,https://archive.org/details/BP_TRH_0160/mode/2up?view=theater,https://archive.org/services/img/BP_TRH_0160,A New Way to Pay Old Debts; The Prisoner at Large,1819-01-06,1819-01-06,Theatre Royal; Hull,P. Massinger/J. C. Kemble; J. O'Keeffe,comedy; comedy,"English Playbill collection, Bruce Peel Special Collection, University of Alberta Library","Box01, Folder_04",https://archive.org/details/BP_TRH_0160,Public domain,https://creativecommons.org/publicdomain/mark/1.0/
BP_TRH_0161,https://archive.org/details/BP_TRH_0161/mode/2up?view=theater,https://archive.org/services/img/BP_TRH_0161,"The Iron Chest; Plot and Counterplot; Or, The Portrait of Michael Cervantes",1819-01-07,1819-01-07,Theatre Royal; Hull,[unknown]; unknown],[unknown]; farce,"English Playbill collection, Bruce Peel Special Collection, University of Alberta Library","Box01, Folder_04",https://archive.org/details/BP_TRH_0161,Public domain,https://creativecommons.org/publicdomain/mark/1.0/
BP_TRH_0162,https://archive.org/details/BP_TRH_0162/mode/2up?view=theater,https://archive.org/services/img/BP_TRH_0162,"Othello, Moor of Venice; Turn Out",1819-01-08,1819-01-08,Theatre Royal; Hull,Wm. Shakespeare; [unknown],tragedy; [unknown],"English Playbill collection, Bruce Peel Special Collection, University of Alberta Library","Box01, Folder_04",https://archive.org/details/BP_TRH_0162,Public domain,https://creativecommons.org/publicdomain/mark/1.0/
